International Conference On Artificial Intelligence And Applications	Zurich, Melbourne, London
International Conference On Computer Science And Information Technology	Sydney, Melbourne, London
International Conference On Artificial Intelligence And Soft Computing	Sydney, Chennai
International Conference On Big Data And Machine Learning	Zurich, Xiamen
International Conference On Signal And Image Processing	Zurich, Melbourne
The International Conference On Internet Of Things: Systems, Management And Security	Malmo, Malmãö
Acis International Summer Conference On Big Data, Cloud Computing, And Data Science	Kitakyushu
Acis International Summer Conference On Software Engineering, Artificial Intelligence, Networking And Parallel/Distributed Computing	Beijing
Acm Conference On Equity And Access In Algorithms, Mechanisms, And Optimization	San Luis Potosi
Advanced Course On Data Science & Machine Learning	Tuscany
Artificial Intelligence And Cloud Computing Conference	Waseda University In Tokyo
Asia Conference On Computer Vision, Image Processing And Pattern Recognition	Xiamen
Asia Conference On Knowledge And Innovation Management	Bangkok
Asia Conference On Machine Learning And Computing	Bangkok
Asia Conference On Machine Learning, Algorithms And Neural Networks	Xiamen
Asia Service Sciences And Software Engineering Conference	The University Of Tokyo
Asian Conference On Machine Learning	Hanoi
Blockchain And Internet Of Things Conference	Fukuoka
Conference Of Opportunities For Networking, Excellence, Collaboration And Cooperation Among Technologists	J
Conference On Data Mining & Knowledge Management Process	Zurich
Congress On Intelligent Systems	Bengaluru
Congress On Smart Computing Technologies	Sikkim
Cvpr Mobile Ai Workshop And Challenges	Seattle
Cvpr New Trends In Image Restoration And Enhancement Workshop And Challenges	Seattle
Discovery Science	Pisa
Enhancing Ai Acceptability For Healthcare	Orlando
European Conference On Advances In Databases And Information Systems	Bayonne
European Conference On Artificial Intelligence	Santiago De Compostela
European Conference On Machine Learning And Principles And Practice Of Knowledge Discovery In Databases	Vilnius
European Symposium On Artificial Neural Networks, Computational Intelligence And Machine Learning	Bruges
Federated Learning Applications In The Real World	Xanthi
First Cfp : Call For Papers At November To In Casablanca, Morocco	Casablanca
First International Conference On Natural Language Processing And Artificial Intelligence For Cyber Security	Lancaster
Future Insightâ,¢ Conference	Mainz
High Performance Computing And Cluster Technologies Conference	Beijing
Hongkong | International Conference On Pattern Recognition And Intelligent Systems	Hongkong
Ibero-American Conference On Artificial Intelligence	Montevideo
Iberoamerican Congress On Pattern Recognition	Talca
Ieee Artificial Intelligence In Agriculture	Belgrade
Ieee Cybermatics Congress	Copenhagen
Ieee Esas The International Workshop On E-Health Systems & Web Technologies	Osaka
Ieee International Conference On Advanced Video And Signal-Based Surveillance	Niagara Falls
Ieee International Conference On Artificial Intelligence & Green Energy	Yasmine Hammamet
Ieee International Conference On Artificial Intelligence And Knowledge Engineering	Laguna Hills
Ieee International Conference On Computer Systems	Hangzhou
Ieee International Conference On Data Mining	Abu Dhabi
Ieee International Conference On E-Business Engineering	Fudan University
Ieee International Conference On Intelligent Transportation Systems	Edmonton
Ieee International Conference On Omni-Layer Intelligent Systems	London
Ieee International Conference On Pattern Recognition Systems	London
Ieee International Conference On Research And Education In Mechatronics	Dead Sea
Ieee International Conference On Smart Data	Copenhagen
Ieee International Conference On Software Engineering And Artificial Intelligence	Xiamen
Ieee International Conference On Systems, Man, And Cybernetics	Kuching
Ieee Latin America Conference On Computational Intelligence	Bogota
Ieee Symposium On Computational Intelligence For Financial Engineering And Economics	Hoboken
Ieee The International Conference On Computer Communication And Artificial Intelligence	Xidian University
Ieee The International Conference On Intelligent Transportation Engineering	Xi'An
Ieee Workshop On Computer Vision For Microscopy Image Analysis	Seattle Wa
Ieee Workshop On Multimodal Content Moderation	Seattle Wa
Ieee/Acm IntâL Conf, On Big Data Computing, Applications, And Technologies	Sharjah
Ieee/Wic International Conference On Web Intelligence And Intelligent Agent Technology	Bangkok
Ifip Conference E-Business, E-Services, And E-Society	Heerlen
Imaging The Ai Landscape After The Ai Act	Malmãö
Informed Machine Learning For Complex Data Special Session At Esann	Bruges
Intelligent Distributed Computing	Brighton
Intelligent Methods, Systems, And Applicationsâ	Cairo
International Artificial Intelligence And Blockchain Conference	The University Of Tokyo
International Artificial Intelligence Technology Conference	Qingdao
International Communication Engineering And Cloud Computing Conference	Chengdu
International Computing And Combinatorics Conference	Shanghai
International Conference Of Advanced Computer Science & Information Technology	Copenhagen
International Conference Of Artificial Intelligence In Medicine	Salt Lake City
International Conference Of Information Technology, Control And Automation	Copenhagen
International Conference Of Managing Value And Supply Chains	Toronto
International Conference Of Multidisciplinary & Interdisciplinary Bioscience	Dubai
International Conference Of Security, Privacy And Trust Management	Sydney
International Conference On Ad Hoc, Sensor & Ubiquitous Computing	Vancouver
International Conference On Advanced Electronics, Electrical And Green Energy	Chengdu
International Conference On Advanced Information Technologies And Applications	Vancouver
International Conference On Advanced Machine Learning	Sydney
International Conference On Advanced Materials Research And Manufacturing Technologies	Cape Town
International Conference On Advanced Natural Language Processing	Vancouver
International Conference On Advanced Robotics, Automation Engineering And Machine Learning	Hangzhou
International Conference On Advances In Artificial Intelligence Techniques	London
International Conference On Advances In Computer Technology, Information Science And Communications	Sanya
International Conference On Advances In Computer Vision, Image And Virtualization	Sanya
International Conference On Advances In Computing & Information Technologies	Copenhagen
International Conference On Advances In Engineering	Copenhagen
International Conference On Ai, Machine Learning In Communications And Networks	London
International Conference On Applications Of Graph Theory In Wireless Ad Hoc Networks And Sensor Networks	London
International Conference On Applied Informatics Imagination, Creativity, Design, Development	Sibiu
International Conference On Artificial Intelligence And Application Technologies	Yokohama
International Conference On Artificial Intelligence And Pattern Recognition	Xiamen
International Conference On Artificial Intelligence And Power Engineering	Sendai
International Conference On Artificial Intelligence And Virtual Reality	Fukuoka
International Conference On Artificial Intelligence Applications And Technologies	Kuala Lumpur
International Conference On Artificial Intelligence In Education Technology	Barcelona
International Conference On Artificial Intelligence, Automation And Automation	Shanghai
International Conference On Artificial Intelligence: Methodology, Systems, Applications Aimsa	Golden Sands
International Conference On Artificial Intelligence: Theory And Applications	Ibs Bangalore
International Conference On Artificial Neural Networks	Lugano-Viganello
International Conference On Big Data	Melbourne
International Conference On Big Data Analytics And Knowledge Discovery	Naples
International Conference On Big Data And Applications	Sydney
International Conference On Big Data And Artificial Intelligence	Beijing
International Conference On Big Data And Computing	Bangkok
International Conference On Big Data And Internet Of Things	Macao
International Conference On Big Data Engineering	Xining
International Conference On Big Data In Management	Chiang Mai
International Conference On Big Data Modeling And Optimization	Huddersfield
International Conference On Big Data Technologies	Hangzhou
International Conference On Big Data, Iot & Nlp	London
International Conference On Big Data, Iot And Machine Learning	Chennai
International Conference On Big Data, Iot, And Cloud Computing	Xishuangbanna
International Conference On Bioinformatics & Biosciences	Toronto
International Conference On Biomedical Engineering And Technology	Seoul
International Conference On Block Chain And Internet Of Things	Zurich
International Conference On Blockchain Technology And Applications	Xi'An
International Conference On Circuits And Systems	Copenhagen
International Conference On Civil Engineering	Copenhagen
International Conference On Cloud And Big Data Computing	Oxford
International Conference On Cloud Computing: Services And Architecture	Zurich
International Conference On Cloud, Big Data And Web Services	Vancouver
International Conference On Communications, Networking And Machine Learning	Shanghai
International Conference On Computational Intelligence And Applications	Haikou
International Conference On Computational Intelligence And Intelligent Systems	Nagoya
International Conference On Computational Science And Engineering	Dubai
International Conference On Computer Networks & Communications	Copenhagen
International Conference On Computer Science And Artificial Intelligence	Beijing
International Conference On Computer Science, Engineering And Information Technology	London
International Conference On Computer Technologies And Development	Huddersfield
International Conference On Computer Technology Applications	Vienna
International Conference On Computer Vision, Graphics And Image Processing	Hangzhou
International Conference On Computer, Software And Modeling	Paris
International Conference On Computers And Automation	Milan
International Conference On Computing And Pattern Recognition	Tianjin
International Conference On Computing, Networks And Internet Of Things	Tokyo
International Conference On Control And Robotics	Yokohama
International Conference On Control And Robotics Engineering	Osaka University
International Conference On Control Science And Systems Engineering	Beijing
International Conference On Control, Robotics And Cybernetics	Penang
International Conference On Control, Robotics Engineering And Technology	Milan
International Conference On Cryptography And Blockchain	Chennai
International Conference On Cryptography, Security And Privacy	Osaka
International Conference On Cybernetics & Informatics	Melbourne
International Conference On Data Intelligence And Cognitive Informatics	Tirunelveli
International Conference On Data Mining & Knowledge Management Process	Vancouver
International Conference On Data Mining & Machine Learning	Sydney
International Conference On Data Mining And Applications	Melbourne
International Conference On Data Mining And Software Engineering	London
International Conference On Data Science And Applications	Mnit Jaipur
International Conference On Data Science And Artificial Intelligence	Medan
International Conference On Data Science And Cloud Computing	Dubai
International Conference On Data Science And Information Technology	Nanjing
International Conference On Data Science And Machine Learning	Riyadh
International Conference On Data Science, Technology And Applications	Dijon
International Conference On Deep Learning Technologies	Suzhou
International Conference On Dependency Linguistics	Washington D
International Conference On Digital Manufacturing And Automation	Changchun
International Conference On Education & Information Technology	Copenhagen
International Conference On Electronics Information And Emergency Communication	Beijing
International Conference On Extended Reality	Lecce
International Conference On Foundations Of Computer Science & Technology	Copenhagen
International Conference On Frontiers Of Artificial Intelligence And Machine Learning	Chongqing
International Conference On Frontiers Of Intelligent Technology	Macau
International Conference On High Performance Compilation, Computing And Communications	Guangzhou
International Conference On HumanâMachine Interaction	Xi'An
International Conference On Image Processing And Artificial Intelligence	Paris
International Conference On Image Processing And Pattern Recognition	Sydney
International Conference On Information And Network Technologies	Tokyo
International Conference On Information Security And Privacy Protection	Nanjing
International Conference On Information System And Data Mining	Los Angeles
International Conference On Information Systems Engineering	Chiang Mai
International Conference On Information Technology And Internet Of Things	London
International Conference On Information, Intelligence, Systems And Applications	Chania
International Conference On Innovation, Knowledge, And Management	Rome
International Conference On Intelligent Computing	Tianjin
International Conference On Intelligent Computing And Wireless Optical Communications	Chongqing
International Conference On Intelligent Engineering And Management	London
International Conference On Intelligent Information Processing	Oxford
International Conference On Intelligent Perception And Computer Vision	Xiamen
International Conference On Intelligent Robotics And Control Engineering	Xi'An
International Conference On Intelligent Systems And Pattern Recognition	Istanbul
International Conference On Intelligent Systems Design And Engineering Applications	Tottori
International Conference On Intelligent Technology And Embedded Systems	Chengdu
International Conference On Intelligent Traffic And Transportation	Florence
International Conference On Internet Of Things	London
International Conference On Knowledge Discovery	Macau S
International Conference On Knowledge-Based And Intelligent Information And Engineering Systems	Seville
International Conference On Machine Intelligence And Emerging Technologies	Noakhali
International Conference On Machine Intelligence For Geoanalytics And Remote Sensing	Wellington
International Conference On Machine Learning & Applications	London
International Conference On Machine Learning & Trends	Vancouver
International Conference On Machine Learning And Applications	Miami
International Conference On Machine Learning Technologies	Oslo
International Conference On Machine Vision	Edinburgh
International Conference On Management Information System	Tokyo
International Conference On Mathematics And Artificial Intelligence	Beijing
International Conference On Mechanical And Aerospace Engineering	Zagreb
International Conference On Mechanical And Intelligent Manufacturing Technologies	Cape Town
International Conference On Mechanical Engineering And Vehicle Engineering	Wuxi
International Conference On Mechanical Manufacturing, Robotics And Control Engineering	Chongqing
International Conference On Mechatronics, Robotics And Automation	Wuhan
International Conference On Modeling Decisions For Artificial Intelligence	Tokyo
International Conference On Modelling And Development Of Intelligent Systems	Sibiu
International Conference On Multimedia Information Processing And Retrieval	San Jose
International Conference On Natural Language Computing And Ai	Zurich
International Conference On Natural Language Processing And Artificial Intelligence	Chongqing
International Conference On Natural Language Processing And Information Retrieval	Okayama
International Conference On Natural Language Processing And Machine Learning	Melbourne
International Conference On Networks & Communications	London
International Conference On Networks And Communications	Vancouver
International Conference On Networks And Security	Copenhagen
International Conference On Networks, Communications And Information Technology	Xi'An
International Conference On Networks, Mobile Communications And Telematics	Toronto
International Conference On Neural Computation	Porto
International Conference On Neural Information Processing	Auckland
International Conference On Nlp & Big Data	London
International Conference On Nlp & Data Mining	Chennai
International Conference On Nlp Trends & Technologies	Dubai
International Conference On Novel And Intelligent Digital Systems	Athens
International Conference On Optimization, Learning Algorithms And Applications	Tenerife
International Conference On Parallel Problem Solving From Nature	Hagenberg
International Conference On Parallel, Distributed Computing And Applications	Sydney
International Conference On Pattern Recognition And Intelligent Systems	Hongkong
International Conference On Process Mining	Copenhagen
International Conference On Recent Trends In Image Processing And Pattern Recognition	Bhopal
International Conference On Robotics And Automation Sciences	Tokyo
International Conference On Robotics And Computer Vision	Wuxi
International Conference On Robotics And Intelligent Technology	Macau
International Conference On Scalable Uncertainty Management	Palermo
International Conference On Semantic & Natural Language Processing	Copenhagen
International Conference On Service Robotics	Hangzhou
International Conference On Signal & Image Processing	Dubai
International Conference On Signal Image Processing And Multimedia	Copenhagen
International Conference On Signal Processing	Copenhagen
International Conference On Signal Processing And Machine Learning	Qingdao
International Conference On Signal, Image Processing And Multimedia	London
International Conference On Soft Computing	Dubai
International Conference On Soft Computing & Machine Intelligence	Melbourne
International Conference On Soft Computing And Machine Intelligence	Melbourne
International Conference On Soft Computing, Artificial Intelligence And Applications	Vancouver
International Conference On Soft Computing, Artificial Intelligence And Machine Learning	Copenhagen
International Conference On Soft Computing, Data Mining And Cybersecurity	Xiamen
International Conference On Software And Computing Technologies	Danang
International Conference On Software Engineering	Sydney
International Conference On Software Engineering Advances And Formal Methods	Chennai
International Conference On Software Engineering, Security And Blockchain	Dubai
International Conference On Software Technology And Engineering	Macau
International Conference On Speech And Computer	Belgrade
International Conference On Teaching And Education Management	Barcelona
International Conference On The Integration Of Constraint Programming, Artificial Intelligence, And Operations Research	Uppsala
International Conference On Time Series And Forecasting	Gran Canaria
International Conference On Traffic And Logistic Engineering	Macau
International Conference On Virtual Reality And Image Processing	Macao
International Conference On Vlsi And Applications	Copenhagen
International Conference On Wireless & Mobile Networks	London
International Conference On Wireless Communication And Big Data	Tokyo
International Joint Conference On Computer Vision And Pattern Recognition	Shanghai
International Joint Conference On Conceptual Knowledge Structures	Cadiz
International Joint Conference On Information And Communication Engineering	Fuzhou
International Joint Conference On Robotics And Artificial Intelligence	Shanghai
International Mammalian Synthetic Biology Workshop	Boston
International Symposium Datamod From Data To Models And Back	Aveiro
International Symposium On Computing And Artificial Intelligence	Dali
International Symposium On Digital Forensics And Security	San Antonio
International Symposium On Image Processing And Analysis	Xiamen
International Symposium On Intelligent Unmanned Systems And Artificial Intelligence	Qingdao
International Ubi Summer School	Oulu
International Work-Conference On Bioinformatics And Biomedical Engineering	Gran Canaria
International Workshop On Artificial Intelligence And Education	Tokyo
International Workshop On Artificial Intelligence For Sustainable Development	Sozopol
International Workshop On Big Data Driven Edge Cloud Services	Tampere
International Workshop On Energy Management For Sustainable Internet-Of-Things And Cloud Computing	Vienna
International Workshop On Federated Learning And Foundation Models For Multi-Media	Niagara Falls
International Workshop On Interactive Environments And Emerging Technologies For Elearning	Paris
International Workshop On Machine Learning And Quantum Computing Applications In Medicine And Physics	Warsaw
International Workshop On Pattern Recognition	Xiamen
International Workshop On Software Engineering And Ai For Data Quality	Porto De Galinhas
Internet Of Things: Challenges And Advances	Book By Qusay F
Ipol Â Mlbriefs Workshop Of Reproducible Research	Gif-Sur-Yvette (Paris Suburbs)
Learning And Automata	Tallinn
Leveraging Emerging Ai Paradigms In Biomedical Healthcare	Swansea
Machine Learning Meets Differential Equations: From Theory To Applications	Ecai
Machine Learning Methods In Visualisation For Big Data	Odense
Midwest Cognitive Science Conference	Athens
Minisymposium On High Performance Computing Interval Methods	Ostrava
Multi-Disciplinary International Conference On Artificial Intelligence	Pattaya City
National Conference Smart Stem Education And Innovations	Sofia
New York Annual Conference On Artificial Intelligence	New York
New York Annual Conference On Big Data	New York
New York Annual Conference On Deep Learning	New York
New York Annual Conference On Machine Learning	New York
New York Annual Conference On Neural Networks	New York
Sobigdata Ri Summer School Empowering Data For Social Good	Baratti - Tuscany
Symposium On Conformal And Probabilistic Prediction With Applications	Milan
The Acs/Ieee International Conference On Computer Systems And Applications	Sousse
The Annual Conference Of The European Association For Machine Translation	Sheffield
The Asia Conference On Mechanical Engineering And Aerospace Engineering	Taicang
The Asia-Pacific Conference On Intelligent Robot Systems	Dalian
The Asian Aerospace And Astronautics Conference	Nanjing
The Fifteenth International Conference On Swarm Intelligence	Xining
The Ieee International Conference On Agents	Adelaide
The Ieee International Conference On Intelligent Mobile Computing	Sanghai
The Ieee/Acm International Conference On Utility And Cloud Computing	Sharjah
The International Conference On Advanced Computer Theory And Engineering	Hefei
The International Conference On Advances In Artificial Intelligence	London
The International Conference On Artificial Intelligence And Big Data	Chengdu
The International Conference On Artificial Intelligence And Blockchain Technology	Beijing
The International Conference On Artificial Intelligence And Teacher Education	Beijing
The International Conference On Artificial Intelligence Innovation	Bangkok
The International Conference On Automation And Computing	Sunderland
The International Conference On Automation, Control And Robots	Xiangyang
The International Conference On Belief Functions	Belfast
The International Conference On Big Data And Computational Intelligence	Kyoto
The International Conference On Big Data And Education	Oxford
The International Conference On Big Data Engineering And Education	Chiangmai
The International Conference On Cloud Computing And Big Data Analytics	Chengdu
The International Conference On Communications And Future Internet	Kagoshima
The International Conference On Computer Application Technology	Wenzhou
The International Conference On Computer Modeling And Simulation	Dalian
The International Conference On Computing And Data Analysis	Wenzhou
The International Conference On Computing, Communication, Cybersecurity & Ai	London
The International Conference On Control And Computer Vision	Tianjin
The International Conference On Control, Mechatronics And Automation	Brunel University London
The International Conference On Control, Robotics And Informatics	Danang
The International Conference On Education And Artificial Intelligence Technologies	London
The International Conference On Foundation And Large Language Models	Dubai
The International Conference On Information Communication And Management	France
The International Conference On Information Integration And Web Intelligence	Bratislava
The International Conference On Information Management And Management Science	Beijing
The International Conference On Information Society	Cambridge
The International Conference On Information Technology And Science	Phuket Island
The International Conference On Information Technology: Iot And Smart City	Kuala Lumpur
The International Conference On Intelligent Autonomous Systems	Dalian
The International Conference On Intelligent Computing, Communication, Networking And Services	Dubrovnik
The International Conference On Intelligent Data Science Technologies And Applications	Dubrovnik
The International Conference On Intelligent Systems And Pattern Recognition	Istanbul
The International Conference On Knowledge Engineering And Knowledge Management	Amsterdam
The International Conference On Machine Learning And Intelligent Systems	Universiti Tunku Abdul Rahman
The International Conference On Machine Learning And Machine Intelligence	Osaka
The International Conference On Machine Learning And Pattern Recognition	Osaka
The International Conference On Materials And Intelligent Manufacturing	Inha University
The International Conference On Mechanical Engineering And Robotics Research	Barcelona
The International Conference On Mechanical, Automotive And Materials Engineering	Bangkok
