The International Conference On Pattern Recognition And Artificial Intelligence	Hangzhou
The International Conference On Pattern Recognition And Machine Learning	Chongqing
The International Conference On Progress In Mechanical And Aerospace Engineering	Bangkok
The International Conference On Robot Systems And Applications	Bangkok
The International Conference On Robotics And Mechatronics	Cape Town
The International Conference On Robotics Systems And Automation Engineering	Tokyo
The International Conference On Robotics, Control And Automation Engineering	Wuhu
The International Conference On System Reliability And Safety Engineering	Hangzhou
The International Conference On Virtual Reality	Bournemouth
The International Symposium On Ai	Chengdu
The International Symposium On Information And Communication Technology	Danang
The International Symposium On Innovation In Intelligent Systems And Applciations	Craiova
The International Workshop On Ai System Engineering: Math, Modelling And Software	Naples
The International Workshop On Computer Science And Engineering	Phuket Island
The International Workshop On Cyber-Security And Functional Safety In Cyber-Physical Systems	Naples
The International Workshop Onâ Large-Scale Graph Data Analytics	Guangzhou
The Italian Conference On Big Data And Data Science	Pisa
The Sixth International Conference On Blockchain Computing And Applications	Dubai
The World Symposium On Artificial Intelligence	Guangzhou
The World Symposium On Software Engineering	Kyoto
Third International Symposium On Bioinformatics And Biomedicine	Burgas
Towards An Automated Art? Learning Machines, Human Creativity And Uncertainty	Lisbon
Umr Parsing Workshop	Boulder
Women In Computer Vision Workshop At Cvpr	Seattle
Workshop And Competition On Affective Behavior Analysis In-The-Wild @ Ieee Cvpr	Seattle
Workshop On Applications Of Machine Learning And Artificial Intelligence In High-Performance Computing	Ostrava
Workshop On Deep Learning For Neuro-Heuristic Brain Analysis @	Lugano
Workshop On Reliable Evaluation Of Llms For Factual Information	Buffalo
Xviii National Meeting On Optics And The Ix Andean And Caribbean Conference On Optics And Its Applications	Cartagena
[Scopus] [Acm] International Workshop On Human-Centered Modeling And Adaptation For Digital Transformation	Cagliari
